{
  "benchmark": "realworld",
  "kind": "fullstack-shape",
  "ts": "2026-03-09T04:07:19.657Z",
  "environment": {
    "runtime": "bun@1.3.9",
    "os": "linux",
    "cpu": "x64"
  },
  "metrics": {
    "scenarioCount": 5,
    "contentRouteTtfbMs": 3.47,
    "multiIslandHydrationMs": 559.47,
    "resourceRouteRenderMs": 5.28,
    "mutationRollbackMs": 4.15,
    "workspaceBuildMs": 824.76
  },
  "notes": "Measured artifact generated by benchmarks/realworld/measure.mjs against the built production runtime and workspace reference app."
}
